{
  "manifestVersion": "stage-manifest-v1",
  "runId": "OBSERVED_DEV_20260806_01-A2-03-OCR",
  "runMode": "observed-dev",
  "stageId": "A2-03-OCR",
  "status": "SUCCEEDED",
  "agentId": "P4-A2-PIPELINE",
  "branch": "agent/p4-pipeline-v2",
  "gitHead": "90d120d2a40913b69e53a2f2db79b3abbef86ee3",
  "contractVersion": "2.1.2",
  "schemaVersion": "p4-contract-2.1.2",
  "dataVersion": "observed-dev-20260806.1",
  "crawlReleaseId": "CRAWL_20260806_03",
  "dataProvenance": "OBSERVED_DEVELOPMENT_ONLY",
  "startedAt": "2026-08-06T00:00:00+09:00",
  "completedAt": "2026-08-06T00:00:00+09:00",
  "empiricalAnalysisAllowed": false,
  "promotionAllowed": false,
  "inputManifestSha256": "1ac072923722cb61d6ea011aba2d824774710bae677bc10a1a9427b1df842bf1",
  "parameterSha256": "d44a0f4513c63a2907c185747c57385a8b5b88384cb25ebac615967369c6caa0",
  "rowCounts": {
    "sectionRows": 84,
    "ocrQueueRows": 30,
    "ocrAssetsFetched": 0
  },
  "gateResults": [
    {
      "gateId": "OCR_READY",
      "status": "PASS",
      "evidencePath": "stage_quality.csv"
    }
  ],
  "warnings": [],
  "errors": [],
  "files": [],
  "terminationArtifacts": [
    "stage_manifest.json",
    "stage_metrics.json",
    "stage_quality.csv",
    "CHECKSUMS.sha256"
  ],
  "dataPolicies": {
    "canonicalStorage": "DUCKDB_PARQUET",
    "csvPurpose": "HUMAN_INSPECTION_EXPORT",
    "eligibilityColumns": [
      "postingEligibleFlag",
      "rq1EligibleFlag",
      "rq2EligibleFlag",
      "ncsEligibleFlag"
    ],
    "highDemandScore": "ALL_NULL"
  }
}
