{
  "manifestVersion": "stage-manifest-v1",
  "runId": "OBSERVED_DEV_20260806_01-A2-05-REQUIREMENT",
  "runMode": "observed-dev",
  "stageId": "A2-05-REQUIREMENT",
  "status": "SUCCEEDED",
  "agentId": "P4-A2-PIPELINE",
  "branch": "agent/p4-pipeline-v2",
  "gitHead": "17a905514e28ee762c46a9e8410a15cab02c7560",
  "contractVersion": "2.1.2",
  "schemaVersion": "p4-contract-2.1.2",
  "dataVersion": "observed-dev-20260806.1",
  "crawlReleaseId": "CRAWL_20260806_03",
  "dataProvenance": "OBSERVED_DEVELOPMENT_ONLY",
  "startedAt": "2026-08-06T00:00:00+09:00",
  "completedAt": "2026-08-06T00:00:00+09:00",
  "empiricalAnalysisAllowed": false,
  "promotionAllowed": false,
  "inputManifestSha256": "1ac072923722cb61d6ea011aba2d824774710bae677bc10a1a9427b1df842bf1",
  "parameterSha256": "1475bee87463f6c052bd5f81ad1e495f2a0ff9e66e5df4f29c69a0a4ca161e7a",
  "rowCounts": {
    "requirementRows": 35,
    "dutyRows": 28
  },
  "gateResults": [
    {
      "gateId": "REQUIREMENT_READY",
      "status": "PASS",
      "evidencePath": "stage_quality.csv"
    }
  ],
  "warnings": [],
  "errors": [],
  "files": [
    {
      "path": "EXTERNAL_INPUT/AGENT2_TO_AGENT4_DUTY_INPUT_OBSERVED_DEV.json",
      "sha256": "59a134c6b54d7ba95cebaee585f403fb0d33284ef36b883192703cf2944c3c93",
      "bytes": 15800,
      "rows": null,
      "columns": null,
      "format": "json",
      "grain": "AGENT2_TO_AGENT4_DUTY_INPUT_OBSERVED_DEV",
      "nullablePolicy": "schema-defined nulls preserved",
      "sourceStage": "A2-05-REQUIREMENT",
      "dataProvenance": "OBSERVED_DEVELOPMENT_ONLY"
    }
  ],
  "terminationArtifacts": [
    "stage_manifest.json",
    "stage_metrics.json",
    "stage_quality.csv",
    "CHECKSUMS.sha256"
  ],
  "dataPolicies": {
    "canonicalStorage": "DUCKDB_PARQUET",
    "csvPurpose": "HUMAN_INSPECTION_EXPORT",
    "eligibilityColumns": [
      "postingEligibleFlag",
      "rq1EligibleFlag",
      "rq2EligibleFlag",
      "ncsEligibleFlag"
    ],
    "highDemandScore": "ALL_NULL"
  }
}
