{
  "manifestVersion": "stage-manifest-v1",
  "runId": "observed-dev-20260806.1",
  "runMode": "observed-dev",
  "stageId": "A1-00-RECOVER",
  "status": "SUCCEEDED",
  "agentId": "P4-A1-SOURCE",
  "branch": "agent/p4-crawl-release-v2",
  "gitHead": "71edc867a8e869b78340e4fe253ced9312894077",
  "contractVersion": "2.1.2",
  "schemaVersion": "source-policy-run-v1",
  "dataVersion": "observed-dev-20260806.1",
  "crawlReleaseId": "CRAWL_20260806_03",
  "dataProvenance": "OBSERVED_DEVELOPMENT_ONLY",
  "startedAt": "2026-08-06T00:00:00+09:00",
  "completedAt": "2026-08-06T00:00:00+09:00",
  "empiricalAnalysisAllowed": false,
  "promotionAllowed": false,
  "inputManifestSha256": "f58810b38bde7c7e1c69bf1f7000b3931cadf9d4d544f64b9c9c0d27a63bce8e",
  "parameterSha256": "a8933a511b5347ffa39bef3c86e7809aa781c551ac0f9a536c84d70acb616214",
  "rowCounts": {
    "asset_frontier": 0,
    "detail_frontier": 137,
    "remaining_months": 1
  },
  "gateResults": [
    {
      "gateId": "SOURCE_POLICY_READY",
      "status": "PASS",
      "evidencePath": "crawl/runs/notebooks/observed-dev/MASTER_20260806_01/stages/crawl/notebooks/children/agent_runs/AGENT1/A1-00-RECOVER/resume_state.json"
    },
    {
      "gateId": "OBSERVED_PACKAGE_REFERENCE_ONLY",
      "status": "PASS",
      "evidencePath": "crawl/runs/notebooks/observed-dev/MASTER_20260806_01/stages/crawl/notebooks/children/agent_runs/AGENT1/A1-00-RECOVER/resume_state.json"
    }
  ],
  "warnings": [
    "Observed input is partial and cannot be promoted to empirical analysis."
  ],
  "errors": [],
  "files": [
    {
      "path": "crawl/runs/notebooks/observed-dev/MASTER_20260806_01/stages/crawl/notebooks/children/agent_runs/AGENT1/A1-00-RECOVER/asset_frontier.csv",
      "sha256": "0a1819c234d28b9b17f15cfcc990df75305f99320959782448486e4fbfa986f0",
      "bytes": 74,
      "rows": 0,
      "columns": 6,
      "format": "csv",
      "grain": "A1-00-RECOVER",
      "nullablePolicy": "schema_defined",
      "sourceStage": "A1-00-RECOVER",
      "dataProvenance": "OBSERVED_DEVELOPMENT_ONLY"
    },
    {
      "path": "crawl/runs/notebooks/observed-dev/MASTER_20260806_01/stages/crawl/notebooks/children/agent_runs/AGENT1/A1-00-RECOVER/asset_frontier.parquet",
      "sha256": "34c005769efd344e56ae713725df05b757e46ba0bd0a511f7aa08de7e249f917",
      "bytes": 3246,
      "rows": 0,
      "columns": 6,
      "format": "parquet",
      "grain": "A1-00-RECOVER",
      "nullablePolicy": "schema_defined",
      "sourceStage": "A1-00-RECOVER",
      "dataProvenance": "OBSERVED_DEVELOPMENT_ONLY"
    },
    {
      "path": "crawl/runs/notebooks/observed-dev/MASTER_20260806_01/stages/crawl/notebooks/children/agent_runs/AGENT1/A1-00-RECOVER/detail_frontier.csv",
      "sha256": "bb43b4978352b830cdd83c19caaef399579a1931a3170975acff25cceab6d9f5",
      "bytes": 13019,
      "rows": 137,
      "columns": 10,
      "format": "csv",
      "grain": "A1-00-RECOVER",
      "nullablePolicy": "schema_defined",
      "sourceStage": "A1-00-RECOVER",
      "dataProvenance": "OBSERVED_DEVELOPMENT_ONLY"
    },
    {
      "path": "crawl/runs/notebooks/observed-dev/MASTER_20260806_01/stages/crawl/notebooks/children/agent_runs/AGENT1/A1-00-RECOVER/detail_frontier.parquet",
      "sha256": "2c8a51164a759475f8175dec1c12d600dd65a99868a452b547d79b2bebbcfaa4",
      "bytes": 12809,
      "rows": 137,
      "columns": 10,
      "format": "parquet",
      "grain": "A1-00-RECOVER",
      "nullablePolicy": "schema_defined",
      "sourceStage": "A1-00-RECOVER",
      "dataProvenance": "OBSERVED_DEVELOPMENT_ONLY"
    },
    {
      "path": "crawl/runs/notebooks/observed-dev/MASTER_20260806_01/stages/crawl/notebooks/children/agent_runs/AGENT1/A1-00-RECOVER/remaining_months.csv",
      "sha256": "ba5c51d1b96cb7136b4c5d4d8531cd355c0cfcd81b4056c3ff54c8540e6bddf1",
      "bytes": 158,
      "rows": 1,
      "columns": 3,
      "format": "csv",
      "grain": "A1-00-RECOVER",
      "nullablePolicy": "schema_defined",
      "sourceStage": "A1-00-RECOVER",
      "dataProvenance": "OBSERVED_DEVELOPMENT_ONLY"
    },
    {
      "path": "crawl/runs/notebooks/observed-dev/MASTER_20260806_01/stages/crawl/notebooks/children/agent_runs/AGENT1/A1-00-RECOVER/resume_state.json",
      "sha256": "c9908491b8ae1d11b149f220ad601eb6c66b008d032d82369926e4e760c7181a",
      "bytes": 283,
      "rows": null,
      "columns": null,
      "format": "json",
      "grain": "A1-00-RECOVER",
      "nullablePolicy": "schema_defined",
      "sourceStage": "A1-00-RECOVER",
      "dataProvenance": "OBSERVED_DEVELOPMENT_ONLY"
    }
  ],
  "terminationArtifacts": [
    "stage_manifest.json",
    "stage_metrics.json",
    "stage_quality.csv",
    "CHECKSUMS.sha256"
  ],
  "dataPolicies": {
    "canonicalStorage": "DUCKDB_PARQUET",
    "csvPurpose": "HUMAN_INSPECTION_EXPORT",
    "eligibilityColumns": [
      "postingEligibleFlag",
      "rq1EligibleFlag",
      "rq2EligibleFlag",
      "ncsEligibleFlag"
    ],
    "highDemandScore": "ALL_NULL"
  }
}
