{
  "manifestVersion": "stage-manifest-v1",
  "runId": "OBSERVED_DEV_20260806_01-A2-11-EXPORT-QA",
  "runMode": "observed-dev",
  "stageId": "A2-11-EXPORT-QA",
  "status": "SUCCEEDED",
  "agentId": "P4-A2-PIPELINE",
  "branch": "agent/p4-pipeline-v2",
  "gitHead": "90d120d2a40913b69e53a2f2db79b3abbef86ee3",
  "contractVersion": "2.1.2",
  "schemaVersion": "preprocessing-qa-v1",
  "dataVersion": "observed-dev-20260806.1",
  "crawlReleaseId": "CRAWL_20260806_03",
  "dataProvenance": "OBSERVED_DEVELOPMENT_ONLY",
  "startedAt": "2026-08-06T00:00:00+09:00",
  "completedAt": "2026-08-06T00:00:00+09:00",
  "empiricalAnalysisAllowed": false,
  "promotionAllowed": false,
  "inputManifestSha256": "1ac072923722cb61d6ea011aba2d824774710bae677bc10a1a9427b1df842bf1",
  "parameterSha256": "1785d58b11fc8d1e421e8b102918830a2fd69bc5abd023c5fea60d37a3428932",
  "rowCounts": {
    "checks": 24,
    "passed": 24,
    "failed": 0
  },
  "gateResults": [
    {
      "gateId": "PREPROCESSED_CSV_READY",
      "status": "PASS",
      "evidencePath": "stage_quality.csv"
    }
  ],
  "warnings": [],
  "errors": [],
  "files": [
    {
      "path": "data/exports/observed-dev/OBSERVED_DEV_20260806_01/stage_quality.csv",
      "sha256": "966a92d09bad2bf8e63375fb55adae2b819f95506860c323369fc35bda10773c",
      "bytes": 3343,
      "rows": 24,
      "columns": 7,
      "format": "csv",
      "grain": "stage_quality",
      "nullablePolicy": "schema-defined nulls preserved",
      "sourceStage": "A2-11-EXPORT-QA",
      "dataProvenance": "OBSERVED_DEVELOPMENT_ONLY"
    },
    {
      "path": "data/exports/observed-dev/OBSERVED_DEV_20260806_01/data_quality_summary.csv",
      "sha256": "701805c11132ebe37a88a1837a13a8a5a7e77ac157146b10f851ef204f94ba59",
      "bytes": 136,
      "rows": 1,
      "columns": 7,
      "format": "csv",
      "grain": "data_quality_summary",
      "nullablePolicy": "schema-defined nulls preserved",
      "sourceStage": "A2-11-EXPORT-QA",
      "dataProvenance": "OBSERVED_DEVELOPMENT_ONLY"
    },
    {
      "path": "data/exports/observed-dev/OBSERVED_DEV_20260806_01/stage_metrics.json",
      "sha256": "875d1ded8f2776d535ead7fff0bb98e7704996518d961b7954323c27a50c1a27",
      "bytes": 4744,
      "rows": null,
      "columns": null,
      "format": "json",
      "grain": "stage_metrics",
      "nullablePolicy": "schema-defined nulls preserved",
      "sourceStage": "A2-11-EXPORT-QA",
      "dataProvenance": "OBSERVED_DEVELOPMENT_ONLY"
    },
    {
      "path": "data/exports/observed-dev/OBSERVED_DEV_20260806_01/stage_manifest.json",
      "sha256": "94174e98e75c117d8fa65130ab9ccd9e88022aba0b3097faed9214368a834832",
      "bytes": 8947,
      "rows": null,
      "columns": null,
      "format": "json",
      "grain": "stage_manifest",
      "nullablePolicy": "schema-defined nulls preserved",
      "sourceStage": "A2-11-EXPORT-QA",
      "dataProvenance": "OBSERVED_DEVELOPMENT_ONLY"
    },
    {
      "path": "data/exports/observed-dev/OBSERVED_DEV_20260806_01/CHECKSUMS.sha256",
      "sha256": "8f08524256a3e215cfff0f7f6a008a6a2e7e6a7b138346f521136b17eba4ac52",
      "bytes": 1820,
      "rows": null,
      "columns": null,
      "format": "sha256",
      "grain": "CHECKSUMS",
      "nullablePolicy": "schema-defined nulls preserved",
      "sourceStage": "A2-11-EXPORT-QA",
      "dataProvenance": "OBSERVED_DEVELOPMENT_ONLY"
    }
  ],
  "terminationArtifacts": [
    "stage_manifest.json",
    "stage_metrics.json",
    "stage_quality.csv",
    "CHECKSUMS.sha256"
  ],
  "dataPolicies": {
    "canonicalStorage": "DUCKDB_PARQUET",
    "csvPurpose": "HUMAN_INSPECTION_EXPORT",
    "eligibilityColumns": [
      "postingEligibleFlag",
      "rq1EligibleFlag",
      "rq2EligibleFlag",
      "ncsEligibleFlag"
    ],
    "highDemandScore": "ALL_NULL"
  },
  "mappingPolicy": {
    "mappingMode": "LEXICAL_BASELINE",
    "codeSetStatus": "REVIEW_REQUIRED",
    "goldValidatedFlag": false,
    "denseScore": null
  }
}
